<!ELEMENT datenbank (geraeteListe*, herstellerListe*, kundenListe*, recyclinghofListe*)>

<!-- Geräte Liste -->
<!ELEMENT geraeteListe (geraet*)>
<!ATTLIST geraeteListe geraeteListeID NMTOKEN #REQUIRED>
<!ELEMENT geraet (bestandteile+)>
<!ATTLIST geraet geraetID NMTOKEN #REQUIRED>
<!ATTLIST geraet geraetBezeichnung CDATA #REQUIRED>
<!ATTLIST geraet zustand (neuwertig | gut | defekt) #REQUIRED>
<!ATTLIST geraet verschmutzungsgrad (gereinigt | akzeptabel | verschmutzt) #REQUIRED>
<!ATTLIST geraet geraetekategorie CDATA #REQUIRED>
<!ATTLIST geraet hersteller CDATA #REQUIRED>


<!-- Hersteller muss mindenstens eine Adresse besitzen, kann aber auch mehrere haben. -->
<!ELEMENT herstellerListe (hersteller*)>
<!ELEMENT hersteller (adresse+)>
<!ATTLIST hersteller herstellerID NMTOKEN #REQUIRED>

<!-- Recyclinghof -->
<!ELEMENT recyclinghofListe (recyclinghof*)>
<!ELEMENT recyclinghof (adresse, oeffnungszeiten+,spezialgebiet+)>
<!ELEMENT oeffnungszeiten (#PCDATA)>
<!ELEMENT spezialgebiet (#PCDATA)>
<!ATTLIST recyclinghof recyclinghofID NMTOKEN #REQUIRED>

<!-- Angabe der Kundenadresse ist optional, kundenID jedoch Pflicht. -->
<!ELEMENT kundenListe (kunde*)>
<!ELEMENT kunde (adresse?)>
<!ATTLIST kunde kundenID CDATA #REQUIRED>
<!ATTLIST kunde geraeteListe NMTOKEN #REQUIRED>

<!-- Adresse kann mehrere Telefonnummern beinhalten, muss aber mindestens eine besitzen. -->
<!ELEMENT adresse (name+ , strasse? , plz? , ort? , telefon+)>
<!ELEMENT name (#PCDATA)>
<!ELEMENT strasse (#PCDATA)>
<!ELEMENT plz (#PCDATA)>
<!ELEMENT ort (#PCDATA)>
<!ELEMENT telefon (#PCDATA)>

<!-- Liste der Bestandteile -->
<!-- Bestanteilname nicht festgelegt, um Möglichkeiten flexibel zu gestalten -->
<!ELEMENT bestandteile (bestandteil+)>
<!ATTLIST bestandteil name CDATA #REQUIRED>
<!ATTLIST bestandteil anteil CDATA #REQUIRED>
<!ATTLIST bestandteil recyclinggrad CDATA #REQUIRED>


<!-- Ein konkretes Bestandteil -->
<!ELEMENT bestandteil (#PCDATA)>

